{
  "environment": "TEST",
  "accountName": "มะลิปัง TEST",
  "policyVersion": "TEST-PROMO-2026-09-01-v1",
  "defaultEnabled": false,
  "rule": {
    "eligibleProductSize": "NORMAL",
    "eligibleQuantity": 3,
    "bundlePriceSatang": 10000,
    "remainderPriceSatang": 3900,
    "mixEligibleFillings": true,
    "excluded": ["SMALL", "CHIFFON", "COOKIE", "OTHER"]
  },
  "activation": {
    "requiresTestAdminAuthentication": true,
    "requiresSeparateOwnerAllowlist": true,
    "requiresStartAndEndTime": true,
    "timeZone": "Asia/Bangkok",
    "timestampPrecision": "WHOLE_SECOND",
    "requiresSameCalendarDay": true,
    "latestEndLocalTime": "23:59:59",
    "endMustBeAfterStart": true,
    "autoDisableAtEnd": true,
    "approvedOwnerAllowlist": ["OWNER_TEST"],
    "appliesTo": ["NEW_DRAFT", "STAFF_CREATED_REPRICING_REVISION"],
    "ownerIdentifierStoredInRepository": true,
    "rejectedChangesAreAuditedRedacted": true
  }
}
